{
  "schema_version": "1.1.0",
  "provider": "aws",
  "org_id": "o-2a1b2c3d4e",
  "timestamp": "2026-03-30T00:00:00Z",
  "accounts": [
    {
      "id": "111111111111",
      "name": "prod",
      "principals": [
        {
          "id": "111111111111/ci-bot",
          "name": "ci-bot",
          "arn": "arn:aws:iam::111111111111:user/ci-bot",
          "tags": {
            "Team": ["Platform"]
          }
        },
        {
          "id": "111111111111/reader",
          "name": "reader",
          "arn": "arn:aws:iam::111111111111:user/reader",
          "tags": {
            "Team": ["Security"]
          }
        }
      ],
      "roles": [
        {
          "id": "111111111111/AdminRole",
          "name": "AdminRole",
          "arn": "arn:aws:iam::111111111111:role/AdminRole",
          "admin": true,
          "trusted_principals": ["111111111111/ci-bot"],
          "trust": {
            "wildcard_principal": true,
            "require_mfa": false,
            "source_identity": "panoptes",
            "resource_tags": {
              "PrivEscalation": "deny"
            }
          },
          "tags": {
            "PrivEscalation": "deny"
          }
        },
        {
          "id": "111111111111/AuditRole",
          "name": "AuditRole",
          "arn": "arn:aws:iam::111111111111:role/AuditRole",
          "trusted_principals": ["111111111111/reader"],
          "trust": {
            "allowed_org_id": "o-2a1b2c3d4e",
            "require_mfa": true,
            "source_identity": "panoptes"
          }
        }
      ]
    }
  ],
  "notes": "Deterministic AWS MVP fixture for collect/normalize/analyze tests.",
  "metadata": {
    "source": "fixture"
  }
}
